{
  "candidate": {
    "build": {
      "artifact_digest": "sha256:e4202698e3442086b2aa69de8d9a155740d2ddcb234905cc6e7108ed54f2b636",
      "default_features": false,
      "features": [
        "rustls-tls"
      ],
      "kind": "prebuilt",
      "profile": "admitted-oci+no-default-features+rustls-tls",
      "source_revision": "2090ad1c65ddb39497601a936a9fe17d66254bfe",
      "toolchain": "prebuilt"
    },
    "configuration_digest": "sha256:d4d0acfaaea0081264f01d4bd41f3bff8be83575ea152e6bd723390284bf6c74",
    "harness": {
      "admission_ref": "github:SemperSupra/model-spelunker@f03859d11da391706cedeb12a1d37e66bd234ee7:qualification/harness-artifacts/goose-2090ad1c65dd-linux-x64.admission.json",
      "artifact_ref": "ghcr.io/sempersupra/model-spelunker-harness-goose@sha256:e4202698e3442086b2aa69de8d9a155740d2ddcb234905cc6e7108ed54f2b636",
      "name": "goose",
      "version": "1.51.0"
    },
    "model": {
      "artifact_ref": "ollama-sha256:8f68893c685c3ddff2aa3fffce2aa60a30bb2da65ca488b61fff134a4d1730e7",
      "id": "qwen3:1.7b",
      "provider": "ollama"
    },
    "toolset": [
      "developer"
    ]
  },
  "evidence_digest": "sha256:1bfa7cd527b0fcdef975a51c82c0f5c444a6470e92c3b3bccdc188f341da5c36",
  "observation": {
    "cache_read_tokens": null,
    "cache_write_tokens": null,
    "candidate_exit_code": 124,
    "cost": null,
    "engine_error_types": [],
    "failure_class": "timeout",
    "failure_signals": [
      "timeout",
      "state-unchanged"
    ],
    "human_interventions": 0,
    "input_tokens": null,
    "output_tokens": null,
    "state_changed": false,
    "success": false,
    "timed_out": true,
    "tool_calls": null,
    "verifier_exit_code": 1,
    "wall_seconds": 120.057504,
    "workload": {
      "model_rounds": 1,
      "serving_providers": [
        "ollama"
      ]
    }
  },
  "run_id": "20260921T100622Z-66457dbe",
  "schema_version": 1,
  "substrate": {
    "profile_commit": "prebuilt-goose-ollama-v1",
    "profile_id": "gha-linux-x64-goose-prebuilt-ollama"
  },
  "task": {
    "id": "text-repair-v0",
    "package_digest": "sha256:a51be2ffb8cbe2cacac72f038bb88a1649d491ff853244adb729981c9d6c24cc",
    "source_commit": "9192e33afcd05b202998f35ada6e564ec82fc727",
    "task_class": "software.bounded-repair"
  }
}
