{
  "candidate": {
    "build": {
      "default_features": false,
      "features": [],
      "kind": "user-local-npm",
      "profile": "windows-x64",
      "source_revision": "v1.19.3",
      "toolchain": "node-v24"
    },
    "configuration_digest": "sha256:51420dd21cd13d6fc36e4edc321bffe2641c866967317658e67c80da084afb44",
    "harness": {
      "name": "opencode",
      "version": "1.19.3"
    },
    "model": {
      "artifact_ref": "gguf-sha256:qwen3-coder-30b-a3b-instruct-q8_0",
      "id": "qwen3-coder-30b",
      "provider": "llama-server"
    },
    "toolset": [
      "files",
      "shell"
    ]
  },
  "evidence_digest": "sha256:2fdce2ab6ecd0795f7765b1555d81d9a84783b22e3c813d1efd03fabd95adf52",
  "observation": {
    "cache_read_tokens": null,
    "cache_write_tokens": null,
    "candidate_exit_code": 0,
    "cost": null,
    "engine_error_types": [],
    "failure_class": null,
    "failure_signals": [],
    "human_interventions": 0,
    "input_tokens": null,
    "mobile_action_count": 0,
    "mobile_actions": [],
    "output_tokens": null,
    "state_changed": true,
    "success": true,
    "termination_class": "semantic-success",
    "timed_out": false,
    "tool_calls": null,
    "verifier_exit_code": 0,
    "wall_seconds": 9.61,
    "workload": {
      "model_calls_started": 0,
      "model_rounds": 0
    }
  },
  "resources": {
    "cpu_model": "Intel64 Family 6 Model 158 Stepping 10, GenuineIntel",
    "cpu_quota_cores": null,
    "cpuset_cpus_effective": null,
    "logical_cpus_visible": 12,
    "memory_total_bytes": null
  },
  "run_id": "20261018T082917Z-d63bf96d",
  "schema_version": 1,
  "substrate": {
    "profile_commit": "bcd773176a0402881613e820c1b4602f01e3263b",
    "profile_id": "local-windows-11-x64"
  },
  "task": {
    "id": "text-repair-v0",
    "package_digest": "sha256:072f1a521e979b8c9ea76f3a680f59c62ee5d11518171d82a9f4626e2d6c2884",
    "source_commit": "bcd773176a0402881613e820c1b4602f01e3263b",
    "task_class": "software.bounded-repair"
  }
}
