{
  "candidate": {
    "build": {
      "default_features": false,
      "features": [],
      "kind": "user-local-npm",
      "profile": "windows-x64",
      "source_revision": "v1.3.0",
      "toolchain": "node-v24"
    },
    "configuration_digest": "sha256:1fc047e2e80d11ad95ab18922d3c63fe1d4e7a60745cdcf96cb28b0d63da7797",
    "harness": {
      "name": "pi",
      "version": "1.3.0"
    },
    "model": {
      "artifact_ref": "gguf-sha256:qwen3-coder-30b-a3b-instruct-q8_0",
      "id": "qwen3-coder-30b",
      "provider": "llama-server"
    },
    "toolset": [
      "read",
      "write",
      "edit"
    ]
  },
  "evidence_digest": "sha256:80e902900ba99facd1027a8739a7855b37ddc229ee7881647cee05d39cca3efc",
  "observation": {
    "cache_read_tokens": null,
    "cache_write_tokens": null,
    "candidate_exit_code": 0,
    "cost": null,
    "engine_error_types": [],
    "failure_class": null,
    "failure_signals": [],
    "human_interventions": 0,
    "input_tokens": null,
    "mobile_action_count": 0,
    "mobile_actions": [],
    "output_tokens": null,
    "state_changed": true,
    "success": true,
    "termination_class": "semantic-success",
    "timed_out": false,
    "tool_calls": null,
    "verifier_exit_code": 0,
    "wall_seconds": 2.641,
    "workload": {
      "model_calls_started": 0,
      "model_rounds": 0
    }
  },
  "resources": {
    "cpu_model": "Intel64 Family 6 Model 158 Stepping 10, GenuineIntel",
    "cpu_quota_cores": null,
    "cpuset_cpus_effective": null,
    "logical_cpus_visible": 12,
    "memory_total_bytes": null
  },
  "run_id": "20261017T182053Z-c11c3b74",
  "schema_version": 1,
  "substrate": {
    "profile_commit": "05c1044837afa6929eb63c1dbae3574fac57a82a",
    "profile_id": "local-windows-11-x64"
  },
  "task": {
    "id": "text-repair-v0",
    "package_digest": "sha256:072f1a521e979b8c9ea76f3a680f59c62ee5d11518171d82a9f4626e2d6c2884",
    "source_commit": "05c1044837afa6929eb63c1dbae3574fac57a82a",
    "task_class": "software.bounded-repair"
  }
}
