{
  "candidate": {
    "build": {
      "default_features": false,
      "features": [],
      "kind": "user-local-npm",
      "profile": "windows-x64",
      "source_revision": "v1.3.0",
      "toolchain": "node-v24"
    },
    "configuration_digest": "sha256:1fc047e2e80d11ad95ab18922d3c63fe1d4e7a60745cdcf96cb28b0d63da7797",
    "harness": {
      "name": "pi",
      "version": "1.3.0"
    },
    "model": {
      "artifact_ref": "gguf-sha256:qwen3-coder-30b-a3b-instruct-q8_0",
      "id": "qwen3-coder-30b",
      "provider": "llama-server"
    },
    "toolset": [
      "read",
      "write",
      "edit"
    ]
  },
  "evidence_digest": "sha256:d8b30cabaef6c6ac48ab3a9f44452e175d7a1ce8ee241696ce44f7c5ade6fce1",
  "observation": {
    "cache_read_tokens": null,
    "cache_write_tokens": null,
    "candidate_exit_code": 0,
    "cost": null,
    "engine_error_types": [],
    "failure_class": null,
    "failure_signals": [],
    "human_interventions": 0,
    "input_tokens": null,
    "mobile_action_count": 0,
    "mobile_actions": [],
    "output_tokens": null,
    "state_changed": true,
    "success": true,
    "termination_class": "semantic-success",
    "timed_out": false,
    "tool_calls": null,
    "verifier_exit_code": 0,
    "wall_seconds": 12.937,
    "workload": {
      "model_calls_started": 0,
      "model_rounds": 0
    }
  },
  "resources": {
    "cpu_model": "Intel64 Family 6 Model 158 Stepping 10, GenuineIntel",
    "cpu_quota_cores": null,
    "cpuset_cpus_effective": null,
    "logical_cpus_visible": 12,
    "memory_total_bytes": null
  },
  "run_id": "20261017T182907Z-27ce00d8",
  "schema_version": 1,
  "substrate": {
    "profile_commit": "bcd773176a0402881613e820c1b4602f01e3263b",
    "profile_id": "local-windows-11-x64"
  },
  "task": {
    "id": "boundary-bugfix-v0",
    "package_digest": "sha256:44ae7cf94159ef53c36dae1b8401c730de0cb7d7ffec2598ce9696f3a7e6b2a3",
    "source_commit": "bcd773176a0402881613e820c1b4602f01e3263b",
    "task_class": "software.bounded-debugging"
  }
}
