{
  "candidate": {
    "build": {
      "default_features": false,
      "features": [],
      "kind": "user-local-uv",
      "profile": "windows-x64",
      "source_revision": "v0.86.2",
      "toolchain": "python-3.12"
    },
    "configuration_digest": "sha256:72abed2339a4d42f22f2ddfcf80941d46f51b17f8e1d7034f8cda1f6540aec85",
    "harness": {
      "name": "aider",
      "version": "0.86.2"
    },
    "model": {
      "artifact_ref": "gguf-sha256:qwen3-coder-30b-a3b-instruct-q8_0",
      "id": "qwen3-coder-30b",
      "provider": "llama-server"
    },
    "toolset": [
      "editor"
    ]
  },
  "evidence_digest": "sha256:4ff6d656942271b9cb5e022899ced52cfbfb15f111d9b5339d5e4fb8f626e7cf",
  "observation": {
    "cache_read_tokens": null,
    "cache_write_tokens": null,
    "candidate_exit_code": 0,
    "cost": null,
    "engine_error_types": [],
    "failure_class": "false-completion",
    "failure_signals": [
      "false-completion"
    ],
    "human_interventions": 0,
    "input_tokens": null,
    "mobile_action_count": 0,
    "mobile_actions": [],
    "output_tokens": null,
    "state_changed": true,
    "success": false,
    "termination_class": "semantic-failure",
    "timed_out": false,
    "tool_calls": null,
    "verifier_exit_code": 1,
    "wall_seconds": 11.375,
    "workload": {
      "model_calls_started": 0,
      "model_rounds": 0
    }
  },
  "resources": {
    "cpu_model": "Intel64 Family 6 Model 158 Stepping 10, GenuineIntel",
    "cpu_quota_cores": null,
    "cpuset_cpus_effective": null,
    "logical_cpus_visible": 12,
    "memory_total_bytes": null
  },
  "run_id": "20261018T084916Z-7c108814",
  "schema_version": 1,
  "substrate": {
    "profile_commit": "bcd773176a0402881613e820c1b4602f01e3263b",
    "profile_id": "local-windows-11-x64"
  },
  "task": {
    "id": "boundary-bugfix-v0",
    "package_digest": "sha256:44ae7cf94159ef53c36dae1b8401c730de0cb7d7ffec2598ce9696f3a7e6b2a3",
    "source_commit": "bcd773176a0402881613e820c1b4602f01e3263b",
    "task_class": "software.bounded-debugging"
  }
}
