{
  "candidate": {
    "configuration_digest": "sha256:c534176c625acbbe58c52ca57e427c22d5958c24d4a691ee537948fd880c25b3",
    "harness": {
      "name": "openworker",
      "version": "5bc10d928e0b64aae74313349a3b17bd19643ae2"
    },
    "model": {
      "id": "nvidia/nemotron-3.5-lightning-30b-a3b",
      "provider": "nvidia",
      "treatment_kind": "model"
    },
    "toolset": [
      "list_files",
      "read_file",
      "write_file"
    ]
  },
  "evidence_digest": "sha256:59c00fadbd2ccd1fed98721ef0b4107a66c96e95841d96ba6ef2038f0df364eb",
  "observation": {
    "cache_read_tokens": 0,
    "cache_write_tokens": 0,
    "candidate_exit_code": 0,
    "cost": null,
    "failure_class": "false-completion",
    "failure_signals": [
      "false-completion",
      "state-unchanged"
    ],
    "human_interventions": 0,
    "input_tokens": 2960,
    "output_tokens": 379,
    "state_changed": false,
    "success": false,
    "timed_out": false,
    "tool_calls": 4,
    "verifier_exit_code": 1,
    "wall_seconds": 54.600139,
    "workload": {
      "client_wall_seconds_total": 53.607266,
      "first_event_seconds_first": 7.462963,
      "first_event_seconds_max": 20.096429,
      "first_event_seconds_min": 0.338156,
      "model_rounds": 4,
      "output_text_bytes_total": 3,
      "reasoning_bytes_total": 876,
      "request_message_bytes_total": 3671,
      "request_tool_schema_bytes_total": 3872,
      "tool_argument_bytes_total": 122
    }
  },
  "run_id": "20260920T165558Z-713471d6",
  "schema_version": 1,
  "substrate": {
    "profile_commit": "15ea4903a060d06c56c20f9f81b02c06541298e0",
    "profile_id": "gha-linux-x64-openworker-hosted-api"
  },
  "task": {
    "id": "validation-discovery-v0",
    "package_digest": "sha256:6e4330510461625808eb8ae5d5c1d9484c6e347d584c6ee77485be32ccc93876",
    "source_commit": "fefcd5b7338bc66d3ae6112787c7fa07145190cb",
    "task_class": "repository.capability-discovery"
  }
}
