{
  "candidate": {
    "configuration_digest": "sha256:eb6b42258796e04b0308eaf0224c09dc141f192c28846c2dd1443df6ff6dfea8",
    "harness": {
      "name": "openworker",
      "version": "5bc10d928e0b64aae74313349a3b17bd19643ae2"
    },
    "model": {
      "id": "openai/gpt-oss-20b",
      "provider": "openrouter",
      "treatment_kind": "model"
    },
    "toolset": [
      "read_file",
      "write_file"
    ]
  },
  "evidence_digest": "sha256:2fc25d97f6b4c071e20d19ef74ba4692d9a2af4bb0d7d4e2c9649fd05bc3b5fe",
  "observation": {
    "cache_read_tokens": 0,
    "cache_write_tokens": 0,
    "candidate_exit_code": 0,
    "cost": null,
    "failure_class": null,
    "failure_signals": [],
    "human_interventions": 0,
    "input_tokens": 418,
    "output_tokens": 70,
    "state_changed": true,
    "success": true,
    "timed_out": false,
    "tool_calls": 1,
    "verifier_exit_code": 0,
    "wall_seconds": 2.104622,
    "workload": {
      "client_wall_seconds_total": 1.239388,
      "first_event_seconds_first": 0.859069,
      "first_event_seconds_max": 0.859069,
      "first_event_seconds_min": 0.247109,
      "model_rounds": 2,
      "output_text_bytes_total": 73,
      "reasoning_bytes_total": 48,
      "request_message_bytes_total": 519,
      "request_tool_schema_bytes_total": 1146,
      "tool_argument_bytes_total": 40
    }
  },
  "run_id": "20260920T142239Z-8a2d6fed",
  "schema_version": 1,
  "substrate": {
    "profile_commit": "15ea4903a060d06c56c20f9f81b02c06541298e0",
    "profile_id": "gha-linux-x64-openworker-hosted-api"
  },
  "task": {
    "id": "text-repair-v0",
    "package_digest": "sha256:a51be2ffb8cbe2cacac72f038bb88a1649d491ff853244adb729981c9d6c24cc",
    "source_commit": "9b236a6d61d2713754fafd0412828a19e150a0ff",
    "task_class": "software.bounded-repair"
  }
}
