{
  "candidate": {
    "configuration_digest": "sha256:ba3d93d2c8862f3743e96f67ccd43ef582699ed23f8f95a34b0b07e5ac7d4a2c",
    "harness": {
      "name": "openworker",
      "version": "5bc10d928e0b64aae74313349a3b17bd19643ae2"
    },
    "model": {
      "id": "deepseek-flash",
      "provider": "deepseek",
      "treatment_kind": "model"
    },
    "toolset": [
      "list_files",
      "read_file",
      "write_file"
    ]
  },
  "evidence_digest": "sha256:49ec45f7611433065bc0b6b1b267580ec577b0e0453b9b6b15fd852821a6ecbc",
  "observation": {
    "cache_read_tokens": 2304,
    "cache_write_tokens": 0,
    "candidate_exit_code": 0,
    "cost": null,
    "engine_error_types": [],
    "failure_class": null,
    "failure_signals": [],
    "human_interventions": 0,
    "input_tokens": 996,
    "output_tokens": 850,
    "state_changed": true,
    "success": true,
    "timed_out": false,
    "tool_calls": 5,
    "verifier_exit_code": 0,
    "wall_seconds": 6.99518,
    "workload": {
      "client_wall_seconds_total": 6.057576,
      "first_event_seconds_first": 1.13189,
      "first_event_seconds_max": 1.13189,
      "first_event_seconds_min": 0.725119,
      "model_rounds": 4,
      "output_text_bytes_total": 2039,
      "reasoning_bytes_total": 0,
      "request_message_bytes_total": 6425,
      "request_tool_schema_bytes_total": 3872,
      "tool_argument_bytes_total": 409
    }
  },
  "run_id": "20260920T173916Z-f650071f",
  "schema_version": 1,
  "substrate": {
    "profile_commit": "15ea4903a060d06c56c20f9f81b02c06541298e0",
    "profile_id": "gha-linux-x64-openworker-hosted-api"
  },
  "task": {
    "id": "boundary-bugfix-v0",
    "package_digest": "sha256:52ffb636ec670b5f89c4acb0d2126c8ac34336c8bafa517097cfd49fd0477cc8",
    "source_commit": "417a8028b81516a1786d5f842554f4e37d37b245",
    "task_class": "software.bounded-debugging"
  }
}
