{
  "candidate": {
    "configuration_digest": "sha256:3c72dfe781fd997fa1364dd5272911da4eee5d155103159741b9da3ef076f9b7",
    "harness": {
      "name": "openworker",
      "version": "5bc10d928e0b64aae74313349a3b17bd19643ae2"
    },
    "model": {
      "id": "openrouter/free",
      "provider": "openrouter",
      "treatment_kind": "router"
    },
    "toolset": [
      "read_file",
      "write_file"
    ]
  },
  "evidence_digest": "sha256:5777475a2908b7ffdfd36da9e017860212229bb92e0ddef2b8782f2f1e2b90f0",
  "observation": {
    "cache_read_tokens": 0,
    "cache_write_tokens": 0,
    "candidate_exit_code": 0,
    "cost": null,
    "failure_class": null,
    "failure_signals": [],
    "human_interventions": 0,
    "input_tokens": 1069,
    "output_tokens": 186,
    "state_changed": true,
    "success": true,
    "timed_out": false,
    "tool_calls": 2,
    "verifier_exit_code": 0,
    "wall_seconds": 14.036959,
    "workload": {
      "client_wall_seconds_total": 13.364327,
      "first_event_seconds_first": 11.370323,
      "first_event_seconds_max": 11.370323,
      "first_event_seconds_min": 0.717052,
      "model_rounds": 3,
      "output_text_bytes_total": 90,
      "reasoning_bytes_total": 537,
      "request_message_bytes_total": 1131,
      "request_tool_schema_bytes_total": 1719,
      "tool_argument_bytes_total": 60
    }
  },
  "run_id": "20260920T140757Z-1bc0dce5",
  "schema_version": 1,
  "substrate": {
    "profile_commit": "15ea4903a060d06c56c20f9f81b02c06541298e0",
    "profile_id": "gha-linux-x64-openworker-hosted-api"
  },
  "task": {
    "id": "text-repair-v0",
    "package_digest": "sha256:a51be2ffb8cbe2cacac72f038bb88a1649d491ff853244adb729981c9d6c24cc",
    "source_commit": "f87409705e02cf75d0d39efe489c167d95937a10",
    "task_class": "software.bounded-repair"
  }
}
