{
  "candidate": {
    "configuration_digest": "sha256:bb9679300a49f48b2136075253a8d3173b1ac1878dc6638ea0d9d69590b58ce8",
    "harness": {
      "name": "openworker",
      "version": "5bc10d928e0b64aae74313349a3b17bd19643ae2"
    },
    "model": {
      "id": "openrouter/free",
      "provider": "openrouter",
      "treatment_kind": "router"
    },
    "toolset": [
      "list_files",
      "read_file",
      "write_file"
    ]
  },
  "evidence_digest": "sha256:bb577d271c899290af40dfb9a60e973726e7c3833a01ec9ccc6481bde2211978",
  "observation": {
    "cache_read_tokens": 0,
    "cache_write_tokens": 0,
    "candidate_exit_code": 0,
    "cost": null,
    "failure_class": null,
    "failure_signals": [],
    "human_interventions": 0,
    "input_tokens": 2658,
    "output_tokens": 1058,
    "state_changed": true,
    "success": true,
    "timed_out": false,
    "tool_calls": 4,
    "verifier_exit_code": 0,
    "wall_seconds": 49.482419,
    "workload": {
      "client_wall_seconds_total": 48.586526,
      "first_event_seconds_first": 1.103421,
      "first_event_seconds_max": 31.254772,
      "first_event_seconds_min": 0.463781,
      "model_rounds": 4,
      "output_text_bytes_total": 0,
      "reasoning_bytes_total": 4451,
      "request_message_bytes_total": 3605,
      "request_tool_schema_bytes_total": 3872,
      "tool_argument_bytes_total": 136
    }
  },
  "run_id": "20260920T165550Z-5d29eb58",
  "schema_version": 1,
  "substrate": {
    "profile_commit": "15ea4903a060d06c56c20f9f81b02c06541298e0",
    "profile_id": "gha-linux-x64-openworker-hosted-api"
  },
  "task": {
    "id": "validation-discovery-v0",
    "package_digest": "sha256:6e4330510461625808eb8ae5d5c1d9484c6e347d584c6ee77485be32ccc93876",
    "source_commit": "fefcd5b7338bc66d3ae6112787c7fa07145190cb",
    "task_class": "repository.capability-discovery"
  }
}
