{
  "candidate": {
    "configuration_digest": "sha256:5e3e1e18c81f7c8be79e950e575806232a86d75ad1451eb5b84d27c2691dc7ce",
    "harness": {
      "name": "openworker",
      "version": "5bc10d928e0b64aae74313349a3b17bd19643ae2"
    },
    "model": {
      "id": "deepseek-flash",
      "provider": "deepseek",
      "treatment_kind": "model"
    },
    "toolset": [
      "read_file",
      "write_file"
    ]
  },
  "evidence_digest": "sha256:b32761b64015bb6f7667b19dcddb8154ee64f382bc2f6e31cf6523362a1a63a2",
  "observation": {
    "cache_read_tokens": 256,
    "cache_write_tokens": 0,
    "candidate_exit_code": 0,
    "cost": null,
    "failure_class": null,
    "failure_signals": [],
    "human_interventions": 0,
    "input_tokens": 583,
    "output_tokens": 89,
    "state_changed": true,
    "success": true,
    "timed_out": false,
    "tool_calls": 1,
    "verifier_exit_code": 0,
    "wall_seconds": 3.239616,
    "workload": {
      "client_wall_seconds_total": 2.3328,
      "first_event_seconds_first": 1.197782,
      "first_event_seconds_max": 1.197782,
      "first_event_seconds_min": 0.775707,
      "model_rounds": 2,
      "output_text_bytes_total": 138,
      "reasoning_bytes_total": 0,
      "request_message_bytes_total": 545,
      "request_tool_schema_bytes_total": 1146,
      "tool_argument_bytes_total": 40
    }
  },
  "run_id": "20260920T141429Z-2c819be7",
  "schema_version": 1,
  "substrate": {
    "profile_commit": "15ea4903a060d06c56c20f9f81b02c06541298e0",
    "profile_id": "gha-linux-x64-openworker-hosted-api"
  },
  "task": {
    "id": "text-repair-v0",
    "package_digest": "sha256:a51be2ffb8cbe2cacac72f038bb88a1649d491ff853244adb729981c9d6c24cc",
    "source_commit": "b86745e95f3fd10f1a9a0a424e6507db5e8ec798",
    "task_class": "software.bounded-repair"
  }
}
